{
  "$schema": "../schemas/headcount.schema.json",
  "version": 2,
  "updated": "2026-10-29",
  "note": "Time series of reported headcount. Public companies: annual employee counts from Form 10-K (fiscal year-ends differ: Dec 31 for Alphabet/Amazon/Meta/Tesla, Jun 30 Microsoft, late Sep Apple, late Jan NVIDIA/Intel, May 31 Oracle) — plotted at fiscal year-end. Private AI labs: dated media estimates (is_estimate=true), shown dashed.",
  "snapshots": [
    {
      "company": "alphabet",
      "as_of": "2020-12-31",
      "employees": 135301,
      "is_estimate": false,
      "basis": "Company Form 10-K annual employee count (fiscal year-end; Dec 31)",
      "sources": [
        {
          "title": "FY 2020 — SEC 10-K filings (annual employee count)",
          "url": "https://www.sec.gov/cgi-bin/browse-edgar?action=getcompany&CIK=0001652044&type=10-K"
        }
      ]
    },
    {
      "company": "alphabet",
      "as_of": "2021-12-31",
      "employees": 156500,
      "is_estimate": false,
      "basis": "Company Form 10-K annual employee count (fiscal year-end; Dec 31)",
      "sources": [
        {
          "title": "FY 2021 — SEC 10-K filings (annual employee count)",
          "url": "https://www.sec.gov/cgi-bin/browse-edgar?action=getcompany&CIK=0001652044&type=10-K"
        }
      ]
    },
    {
      "company": "alphabet",
      "as_of": "2022-12-31",
      "employees": 190234,
      "is_estimate": false,
      "basis": "Company Form 10-K annual employee count (fiscal year-end; Dec 31)",
      "sources": [
        {
          "title": "FY 2022 — SEC 10-K filings (annual employee count)",
          "url": "https://www.sec.gov/cgi-bin/browse-edgar?action=getcompany&CIK=0001652044&type=10-K"
        }
      ]
    },
    {
      "company": "alphabet",
      "as_of": "2023-12-31",
      "employees": 182502,
      "is_estimate": false,
      "basis": "Company Form 10-K annual employee count (fiscal year-end; Dec 31)",
      "sources": [
        {
          "title": "FY 2023 — SEC 10-K filings (annual employee count)",
          "url": "https://www.sec.gov/cgi-bin/browse-edgar?action=getcompany&CIK=0001652044&type=10-K"
        }
      ]
    },
    {
      "company": "alphabet",
      "as_of": "2024-12-31",
      "employees": 183323,
      "is_estimate": false,
      "basis": "Company Form 10-K annual employee count (fiscal year-end; Dec 31)",
      "sources": [
        {
          "title": "FY 2024 — SEC 10-K filings (annual employee count)",
          "url": "https://www.sec.gov/cgi-bin/browse-edgar?action=getcompany&CIK=0001652044&type=10-K"
        }
      ]
    },
    {
      "company": "alphabet",
      "as_of": "2025-12-31",
      "employees": 190820,
      "is_estimate": false,
      "basis": "Company Form 10-K annual employee count (fiscal year-end; Dec 31)",
      "sources": [
        {
          "title": "FY 2025 — SEC 10-K filings (annual employee count)",
          "url": "https://www.sec.gov/cgi-bin/browse-edgar?action=getcompany&CIK=0001652044&type=10-K"
        }
      ]
    },
    {
      "company": "alphabet",
      "as_of": "2026-06-30",
      "employees": 198933,
      "is_estimate": false,
      "basis": "Company Form 10-K annual employee count (fiscal year-end; Dec 31)",
      "sources": [
        {
          "title": "FY 2026 — SEC 10-K filings (annual employee count)",
          "url": "https://www.sec.gov/cgi-bin/browse-edgar?action=getcompany&CIK=0001652044&type=10-K"
        }
      ]
    },
    {
      "company": "amazon",
      "as_of": "2020-12-31",
      "employees": 1298000,
      "is_estimate": false,
      "basis": "Company Form 10-K annual employee count (fiscal year-end; Dec 31)",
      "sources": [
        {
          "title": "FY 2020 — SEC 10-K filings (annual employee count)",
          "url": "https://www.sec.gov/cgi-bin/browse-edgar?action=getcompany&CIK=0001018724&type=10-K"
        }
      ]
    },
    {
      "company": "amazon",
      "as_of": "2021-12-31",
      "employees": 1608000,
      "is_estimate": false,
      "basis": "Company Form 10-K annual employee count (fiscal year-end; Dec 31)",
      "sources": [
        {
          "title": "FY 2021 — SEC 10-K filings (annual employee count)",
          "url": "https://www.sec.gov/cgi-bin/browse-edgar?action=getcompany&CIK=0001018724&type=10-K"
        }
      ]
    },
    {
      "company": "amazon",
      "as_of": "2022-12-31",
      "employees": 1541000,
      "is_estimate": false,
      "basis": "Company Form 10-K annual employee count (fiscal year-end; Dec 31)",
      "sources": [
        {
          "title": "FY 2022 — SEC 10-K filings (annual employee count)",
          "url": "https://www.sec.gov/cgi-bin/browse-edgar?action=getcompany&CIK=0001018724&type=10-K"
        }
      ]
    },
    {
      "company": "amazon",
      "as_of": "2023-12-31",
      "employees": 1525000,
      "is_estimate": false,
      "basis": "Company Form 10-K annual employee count (fiscal year-end; Dec 31)",
      "sources": [
        {
          "title": "FY 2023 — SEC 10-K filings (annual employee count)",
          "url": "https://www.sec.gov/cgi-bin/browse-edgar?action=getcompany&CIK=0001018724&type=10-K"
        }
      ]
    },
    {
      "company": "amazon",
      "as_of": "2024-12-31",
      "employees": 1556000,
      "is_estimate": false,
      "basis": "Company Form 10-K annual employee count (fiscal year-end; Dec 31)",
      "sources": [
        {
          "title": "FY 2024 — SEC 10-K filings (annual employee count)",
          "url": "https://www.sec.gov/cgi-bin/browse-edgar?action=getcompany&CIK=0001018724&type=10-K"
        }
      ]
    },
    {
      "company": "amazon",
      "as_of": "2025-12-31",
      "employees": 1576000,
      "is_estimate": false,
      "basis": "Company Form 10-K annual employee count (fiscal year-end; Dec 31)",
      "sources": [
        {
          "title": "FY 2025 — SEC 10-K filings (annual employee count)",
          "url": "https://www.sec.gov/cgi-bin/browse-edgar?action=getcompany&CIK=0001018724&type=10-K"
        }
      ]
    },
    {
      "company": "apple",
      "as_of": "2020-09-26",
      "employees": 147000,
      "is_estimate": false,
      "basis": "Company Form 10-K annual employee count (fiscal year-end; Sep (FY-end))",
      "sources": [
        {
          "title": "FY 2020 — SEC 10-K filings (annual employee count)",
          "url": "https://www.sec.gov/cgi-bin/browse-edgar?action=getcompany&CIK=0000320193&type=10-K"
        }
      ]
    },
    {
      "company": "apple",
      "as_of": "2021-09-25",
      "employees": 154000,
      "is_estimate": false,
      "basis": "Company Form 10-K annual employee count (fiscal year-end; Sep (FY-end))",
      "sources": [
        {
          "title": "FY 2021 — SEC 10-K filings (annual employee count)",
          "url": "https://www.sec.gov/cgi-bin/browse-edgar?action=getcompany&CIK=0000320193&type=10-K"
        }
      ]
    },
    {
      "company": "apple",
      "as_of": "2022-09-24",
      "employees": 164000,
      "is_estimate": false,
      "basis": "Company Form 10-K annual employee count (fiscal year-end; Sep (FY-end))",
      "sources": [
        {
          "title": "FY 2022 — SEC 10-K filings (annual employee count)",
          "url": "https://www.sec.gov/cgi-bin/browse-edgar?action=getcompany&CIK=0000320193&type=10-K"
        }
      ]
    },
    {
      "company": "apple",
      "as_of": "2023-09-30",
      "employees": 161000,
      "is_estimate": false,
      "basis": "Company Form 10-K annual employee count (fiscal year-end; Sep (FY-end))",
      "sources": [
        {
          "title": "FY 2023 — SEC 10-K filings (annual employee count)",
          "url": "https://www.sec.gov/cgi-bin/browse-edgar?action=getcompany&CIK=0000320193&type=10-K"
        }
      ]
    },
    {
      "company": "apple",
      "as_of": "2024-09-28",
      "employees": 164000,
      "is_estimate": false,
      "basis": "Company Form 10-K annual employee count (fiscal year-end; Sep (FY-end))",
      "sources": [
        {
          "title": "FY 2024 — SEC 10-K filings (annual employee count)",
          "url": "https://www.sec.gov/cgi-bin/browse-edgar?action=getcompany&CIK=0000320193&type=10-K"
        }
      ]
    },
    {
      "company": "apple",
      "as_of": "2025-09-27",
      "employees": 166000,
      "is_estimate": false,
      "basis": "Company Form 10-K annual employee count (fiscal year-end; Sep (FY-end))",
      "sources": [
        {
          "title": "FY 2025 — SEC 10-K filings (annual employee count)",
          "url": "https://www.sec.gov/cgi-bin/browse-edgar?action=getcompany&CIK=0000320193&type=10-K"
        }
      ]
    },
    {
      "company": "meta",
      "as_of": "2020-12-31",
      "employees": 58604,
      "is_estimate": false,
      "basis": "Company Form 10-K annual employee count (fiscal year-end; Dec 31)",
      "sources": [
        {
          "title": "FY 2020 — SEC 10-K filings (annual employee count)",
          "url": "https://www.sec.gov/cgi-bin/browse-edgar?action=getcompany&CIK=0001326801&type=10-K"
        }
      ]
    },
    {
      "company": "meta",
      "as_of": "2021-12-31",
      "employees": 71970,
      "is_estimate": false,
      "basis": "Company Form 10-K annual employee count (fiscal year-end; Dec 31)",
      "sources": [
        {
          "title": "FY 2021 — SEC 10-K filings (annual employee count)",
          "url": "https://www.sec.gov/cgi-bin/browse-edgar?action=getcompany&CIK=0001326801&type=10-K"
        }
      ]
    },
    {
      "company": "meta",
      "as_of": "2022-12-31",
      "employees": 86482,
      "is_estimate": false,
      "basis": "Company Form 10-K annual employee count (fiscal year-end; Dec 31)",
      "sources": [
        {
          "title": "FY 2022 — SEC 10-K filings (annual employee count)",
          "url": "https://www.sec.gov/cgi-bin/browse-edgar?action=getcompany&CIK=0001326801&type=10-K"
        }
      ]
    },
    {